authors,categories,description,edition,imprints(Publishers),isbn10,isbn13,language,Publication date,rating-avg,rating-count,title
,,"Comprehensive, complete, and authoritative coverage of C in one volume. Revised and updated to include the latest developments in C, including the international standard for C, C: The Complete Reference, Fourth Edition answers all of the readers questions clearly and concisely.",1,McGraw Hill Education,70411832,978-0070411838,English,7/1/2017,4.38,,C: The Complete Reference
,,"Start Learning to Program in the C++ Language - In Just One Day! No matter what work you do with computers, there's no escaping the fact that you need to improve your programming skills. C++ Programming: Programing Language for Beginners - Learn in a Day! explains why C++ is so useful and important in the programming world. Most operating systems, compilers, apps, drivers and a lot of other software are all written in C++. If you're a beginner you should choose this programming language first! Find out how to use variables, size changers, sign changers and other prefixes in your C++ code. Learn how to input and output data and write useful programs. Also, find out about the various kinds of operators, conditionals, loops, and arrays! Purchase C++ Programming: Programing Language for Beginners - Learn in a Day! NOW to find out about this essential computing language and stop wasting your money on expensive, time-consuming, and ineffective learning methods.",1,Lulu.com,1329779010,978-1329779013,English,1/7/2016,4.02,,Programming: C ++ Programming: Programming Language for Beginners: Learn in A Day!
,,"This textbook offers clear, extensive coverage of all essential elements of the C++ programming language. Theoretical concepts are described from scratch and are well-supported by pedagogical features, such as solved examples, debugging exercises, points to remember, student-teacher conversations and flow charts.",1,Cambridge University Press ,1316506800,978-1316506806,English,1/16/2017,4.73,,Computer Programming with C++
,,"Providing in-depth coverage, this book covers the fundamentals of computation and programming in C language. Essential concepts including operators and expressions, input and output statements, loop statements, arrays, pointers, functions, strings and preprocessors are described in a lucid manner. A unique approach - 'Learn by quiz' - features questions based on confidence-based learning methodology. It helps the reader to identify the right answer with adequate explanation and reasoning as to why the other options are incorrect. Computer programs and review questions are interspersed throughout the text. The book is appropriate for undergraduate students of engineering, computer science and information technology. It can be used for self-study and assists in the understanding of theoretical concepts and their applications.",1,Cambridge University Press ,1316601854,978-1316601853,English,1/16/2017,4.8,,Basic Computation and Programming with C
,,"""Problem Solving in Data Structures & Algorithms"" is a series of books about the usage of Data Structures and Algorithms in computer programming. The book is easy to follow and is written for interview preparation point of view. In various books, the examples are solved in various languages like Go, C, C++, Java, C#, Python, VB, JavaScript and PHP.",1,Taran Technologies Private Limited,9352655915,978-9352655915,English,8/25/2016,3.6,,Problem Solving in Data Structures & Algorithms Using C
,,"In the third edition of the book ‘C in depth’, the authors explain the basics of the programming language while maintaining the integrity and clarity of the programs. The book can be utilized by both beginners and advanced level programmers as a self-evaluation and learning source.There are more than 310 programs with explanations to illustrate the concepts of programming and over 450 exercises to challenge the readers in programming. These exercises are accompanied by solutions and hints where deemed necessary.The book begins with an introduction to the language and explains the elements, input and output, and operator and expressions used in programming. Control statements, functions, arrays, pointers, strings and files are covered next in successive chapters. Every chapter has examples in the form of programming that are explained step-wise. Five chapters have been added in the third edition, which includes chapters on Recursion and Bitwise Manipulation.Chapters on project development and library creation, code optimization, assembly interactions, and operations on bits may be helpful for further execution of the knowledge of programming.",3,BPB Publications ,9.78818E+12,978-8183330480,English,6/30/2009,4.43,,C in Depth
,,"The book has been written in such a way that the concepts are explained in detail, giving adequate emphasis on code examples. To make the topics more comprehensive, screenshots and code samples are furnished extensively throughout the book. The book is conceptualized and written in such a way that the beginner readers will find it very easy to understand the concepts and implement the programs.The book also features the most current version of Raspberry Pi and associated software with it. This book teaches novice beginners how to write interesting image processing programs with scientific Python ecosystem. The book will also be helpful to experienced professionals to make transition to rewarding careers in scientific Python and computer vision.",1,BPB PUBLICATIONS,9388511727,978-9388511728,English,6/7/2019,4.61,,Python 3 Image Processing
,,"This Book is for Beginners, Research Scholrs & Engineering students",1,CreateSpace Independent Publishing Platform,1541286022,978-1541286023,English,12/26/2016,4.82,,A Practical Approach for Image Processing & Computer Vision In MATLAB
,,"Design for Embedded Image Processing on FPGAs is ideal for researchers and engineers in the vision or image processing industry, who are looking at smart sensors, machine vision, and robotic vision, as well as FPGA developers and application engineers.The book can also be used by graduate students studying imaging systems, computer engineering, digital design, circuit design, or computer science. It can also be used as supplementary text for courses in advanced digital design, algorithm and hardware implementation, and digital signal processing and applications.",1,Wiley-IEEE Press,470828498,978-0470828496,English,9/13/2020,4.85,,Design for Embedded Image Processing on FPGAs
,,"This textbook is the third of three volumes which provide a modern, algorithmic introduction to digital image processing, designed to be used both by learners desiring a firm foundation on which to build, and practitioners in search of critical analysis and concrete implementations of the most important techniques. This volume builds upon the introductory material presented in the first two volumes with additional key concepts and methods in image processing. Features: practical examples and carefully constructed chapter-ending exercises; real implementations, concise mathematical notation, and precise algorithmic descriptions designed for programmers and practitioners; easily adaptable Java code and completely worked-out examples for easy inclusion in existing applications; uses ImageJ; provides a supplementary website with the complete Java source code, test images, and corrections; additional presentation tools for instructors including a complete set of figures, tables, and mathematical elements.",2,Springer,3319024981,978-1848829183,English,5/7/2013,4.9,,Principles of Digital Image Processing: Advanced Methods
,,"This is the second volume of a book series that provides a modern, algori- mic introduction to digital image processing. It is designed to be used both by learners desiring a ?rm foundation on which to build and practitioners in search of critical analysis and modern implementations of the most important techniques. This updated and enhanced paperback edition of our compreh- sive textbook Digital Image Processing: An Algorithmic Approach Using Java packages the original material into a series of compact volumes, thereby s- porting a ?exible sequence of courses in digital image processing. Tailoring the contents to the scope of individual semester courses is also an attempt to p- vide a?ordable (and “backpack-compatible”) textbooks without comprimising the quality and depth of content. This second volume, titled Core Algorithms, extends the introductory - terial presented in the ?rst volume (Fundamental Techniques) with additional techniques that are, nevertheless, part of the standard image processing to- box. A forthcomingthird volume(Advanced Techniques) will extendthis series and add important material beyond the elementary level, suitable for an - vanced undergraduate or even graduate course.",1,Springer,1848001940,978-1848001947,English,3/10/2013,4.91,,Principles of Digital Image Processing: Core Algorithms 
,,"This Handbook is intended to serve as the basic reference point on image and video processing, in the field, in the research laboratory, and in the classroom. Each chapter has been written by carefully selected, distinguished experts specializing in that topic and carefully reviewed by the Editor, Al Bovik, ensuring that the greatest depth of understanding be communicated to the reader. Coverage includes introductory, intermediate and advanced topics and as such, this book serves equally well as classroom textbook as reference resource.",2,Academic Press,9.78012E+12,978-0121197926,English,6/21/2005,4.92,,Handbook of Image and Video Processing
,,"Introductory Digital Image Processing: A Remote Sensing Perspective focuses on digital image processing of aircraft- and satellite-derived, remotely sensed data for Earth resource management applications. Extensively illustrated, it explains how to extract biophysical information from remote sensor data for almost all multidisciplinary land-based environmental projects. Part of the Pearson Series Geographic Information Science.

",4,Pearson,013405816X,978-0134058160,English,5/1/2015,4.23,,Introductory Digital Image Processing: A Remote Sensing Perspective
,,"This is an introductory to intermediate level text on the science of image processing, which employs the Matlab programming language to illustrate some of the elementary, key concepts in modern image processing and pattern recognition. The approach taken is essentially practical and the book offers a framework within which the concepts can be understood by a series of well chosen examples, exercises and computer experiments, drawing on specific examples from within science, medicine and engineering.",2,,470844728,978-0470844724,English,1/4/2011,4.11,,Fundamentals of Digital Image Processing
,,"“Lessons from the Masters” includes a brilliant body of recognized leaders in astronomical imaging, assembled by Robert Gendler, who delivers the most current, sophisticated and useful information on digital enhancement techniques in astrophotography available today. Each chapter focuses on a particular technique, but the book as a whole covers all types of astronomical image processing, including processing of events such as eclipses, using DSLRs, and deep-sky, planetary, widefield, and high resolution astronomical image processing. Recognized contributors include deep-sky experts such as Jay GaBany, Tony Hallas, and Ken Crawford, high-resolution planetary expert Damian Peach, and the founder of TWAN (The World at Night) Babak A. Tafreshi.",1,Springer,1461478332,978-1461478331,English,8/11/2013,4.32,,Lessons from the Masters: Current Concepts in Astronomical Image Processing
,,"This comprehensive and state-of-the art approach to image processing gives engineers and students a thorough introduction, and includes full coverage of key applications: image watermarking, fingerprint recognition, face recognition and iris recognition and medical imaging. ""This book combines basic image processing techniques with some of the most advanced procedures. Introductory chapters dedicated to general principles are presented alongside detailed application-orientated ones. ",1,Academic Press,123744571,978-0123744579,English,6/11/2009,4.57,,The Essential Guide to Image Processing
,,"This textbook is the third of three volumes which provide a modern, algorithmic introduction to digital image processing, designed to be used both by learners desiring a firm foundation on which to build, and practitioners in search of critical analysis and concrete implementations of the most important techniques. This volume builds upon the introductory material presented in the first two volumes with additional key concepts and methods in image processing.",3,SPRINGER (SIE),8132204964,978-8132204961,English,1/1/2012,4.29,,Principles Of Digital Image Processing: Fundamental Techniques
,,"In real-time system, edge detection in image is an important operation that can be applied to large number of digital image processing and computer vision applications such as image segmentation, contour detection and tracking, character recognition, skeleton detection and scene analysis etc. This book help those readers who want to work in this area of image processing and computer vision. The readers will find more practicality of image processing and real understanding of how to start research as a beginner.",1,LAP LAMBERT Academic Publishing,365976809X,978-3659768095,English,11/3/2015,4.69,,Edge Detection using Rough Set Theory
,,"This book is for machine learning developers, deep learning researchers and AI enthusiasts who want to build efficient neural network models to perform efficient image processing tasks. If you want to build powerful computer vision applications using OpenCV and Python frameworks, this book is what you need! Knowledge of Python programming language and working knowledge of machine learning concepts is expected to get the most out of the book",1,,1788627326,978-1788627320,English,,,,Deep Learning with Python and OpenCV













































































































































































































































































































































































































































































































































































































































































































































































































































































































































































































































































































































































































































































































































































































































































































































































































































































































































































































































































































































































































































































































































































































































































































































































































































































































































































































































































































































































































































































































































































































































































































































































































































































































































































































































































































































































































































































































































































































































































































































































































































































































































































































































































































































































































































































































































































































































































































































































































































































































































































































































































































































































































































































































































































































































































































































































































































































































































































































































































































































































































































































































































































